{
 "id": "9",
 "basis": "def2-tzvp",
 "aux": "def2-tzvp-ri",
 "nao": 222,
 "nelec": 66,
 "frozen_core": 18,
 "e_hf": -1268.6015381094,
 "pyscf": "2.14.0",
 "numpy": "2.5.3",
 "python": "3.13.12",
 "machine": "arm64",
 "threads": 1,
 "t_scf_s": 25.316773891448975,
 "singlets_eV": [
  4.949785330314559,
  5.2833854653528105,
  5.494018823406524,
  5.759919970037067
 ],
 "singlets_f": [
  1.0044087927076738e-13,
  1.0300702420366086e-16,
  8.166317383968006e-28,
  0.31870984108773126
 ],
 "t_radc_s": 176.82148599624634,
 "uadc_eV": [
  4.920469090251035,
  4.949789139600463,
  4.980772367972211,
  5.170204994243508,
  5.271403377382201,
  5.283385424799378,
  5.494019623960546,
  5.759920321323253
 ],
 "uadc_f": [
  3.2887037620328376e-29,
  1.0054285110678976e-13,
  3.700316516479711e-28,
  8.510865531514825e-31,
  9.72794534692707e-30,
  6.745183457889862e-17,
  2.133107024223964e-25,
  0.31871573603545855
 ],
 "uadc_s2": [
  1.9999999999991698,
  -1.1020064739369017e-12,
  1.9999999999984928,
  1.9999999999987428,
  1.9999999999986593,
  -1.2796704836319752e-12,
  -1.3673728107029712e-12,
  -1.5931551473350867e-12
 ],
 "t_uadc_s": 2001.6762251853943,
 "triplets_eV": [
  4.920469090251035,
  4.980772367972211,
  5.170204994243508,
  5.271403377382201
 ],
 "S1_eV": 4.949785330314559,
 "T1_eV": 4.920469090251035,
 "dEST_meV": 29.31624006352429
}